{
  "phase": "design",
  "focus": "ai",
  "timestamp": "2026-09-08T02:20:00Z",
  "source_profile": "ai-workload-profile.json",
  "metadata": {
    "ai_sources": [
      {
        "provider": "anthropic",
        "source_service": "anthropic_api",
        "model_families": ["claude"],
        "model_evidence": "observed",
        "models": ["claude-3-5-sonnet-20240620", "claude-3-haiku-20240307"],
        "model_observations": [
          {
            "normalized_model": "claude-3-5-sonnet-20240620",
            "raw_model": "anthropic/claude-3.5-sonnet",
            "model_family": "claude",
            "evidence": [{"provenance": "usage_api", "confidence": "high"}]
          },
          {
            "normalized_model": "claude-3-haiku-20240307",
            "raw_model": "anthropic/claude-3-haiku",
            "model_family": "claude",
            "evidence": [{"provenance": "usage_api", "confidence": "medium"}]
          }
        ]
      },
      {
        "provider": "openai",
        "source_service": "openai_api",
        "model_families": ["gpt"],
        "model_evidence": "observed",
        "models": ["gpt-4o"],
        "model_observations": [
          {
            "normalized_model": "gpt-4o",
            "raw_model": "openai/gpt-4o",
            "model_family": "gpt",
            "evidence": [{"provenance": "usage_api", "confidence": "high"}]
          }
        ]
      }
    ],
    "gateways": [
      {
        "product": "openrouter",
        "type": "llm_router",
        "upstream_evidence": "observed",
        "upstreams": [
          {
            "provider": "anthropic",
            "source_service": "anthropic_api",
            "model_families": [
              {
                "family": "claude",
                "model_evidence": "observed",
                "models": ["claude-3-5-sonnet-20240620", "claude-3-haiku-20240307"]
              }
            ]
          },
          {
            "provider": "openai",
            "source_service": "openai_api",
            "model_families": [
              {
                "family": "gpt",
                "model_evidence": "observed",
                "models": ["gpt-4o"]
              }
            ]
          }
        ]
      }
    ],
    "bedrock_models_selected": ["anthropic.claude-sonnet-5-5", "anthropic.claude-haiku-4-5-20251001-v1:0", "openai.gpt-5.6-terra"],
    "regional_validation": "checked"
  },
  "design_blocks": [
    {
      "workload_id": "wl_router_chat_primary",
      "model_id": "claude-3-5-sonnet-20240620",
      "target_bedrock_model": "anthropic.claude-sonnet-5-5",
      "target_aws_service": null,
      "capability": "text_generation",
      "capability_confidence": "high",
      "rationale": "Primary chat tier routed through OpenRouter to Claude Sonnet; same-family Bedrock target.",
      "confidence_warning": null
    },
    {
      "workload_id": "wl_router_chat_cheap",
      "model_id": "claude-3-haiku-20240307",
      "target_bedrock_model": "anthropic.claude-haiku-4-5-20251001-v1:0",
      "target_aws_service": null,
      "capability": "text_generation",
      "capability_confidence": "high",
      "rationale": "Low-cost tier routed through OpenRouter to Claude Haiku; same-family Bedrock target.",
      "confidence_warning": null
    },
    {
      "workload_id": "wl_router_fallback",
      "model_id": "gpt-4o",
      "target_bedrock_model": "openai.gpt-5.6-terra",
      "target_aws_service": null,
      "capability": "text_generation",
      "capability_confidence": "high",
      "rationale": "OpenRouter fallback upstream to OpenAI maps to GPT-5.6 Terra on Bedrock Mantle.",
      "confidence_warning": null
    }
  ],
  "ai_architecture": {
    "honest_assessment": "strong_migrate",
    "honest_assessment_reason": null,
    "tiered_strategy": {
      "tier_1": "anthropic.claude-sonnet-5-5",
      "tier_2": "anthropic.claude-haiku-4-5-20251001-v1:0",
      "tier_3": "openai.gpt-5.6-terra"
    },
    "bedrock_models": [
      {
        "source_model_id": "claude-3-5-sonnet-20240620",
        "aws_model_id": "anthropic.claude-sonnet-5-5",
        "capabilities_matched": ["text_generation"],
        "capability_gaps": [],
        "honest_assessment": "strong_migrate",
        "source_provider_price": "via OpenRouter — see § Pricing",
        "bedrock_price": "3.00/15.00 per 1M tokens",
        "price_comparison": "favorable",
        "migration_complexity": "medium",
        "model_change": true,
        "migration_path": "direct",
        "quota_risk": "low"
      },
      {
        "source_model_id": "claude-3-haiku-20240307",
        "aws_model_id": "anthropic.claude-haiku-4-5-20251001-v1:0",
        "capabilities_matched": ["text_generation"],
        "capability_gaps": [],
        "honest_assessment": "strong_migrate",
        "source_provider_price": "via OpenRouter — see § Pricing",
        "bedrock_price": "0.25/1.25 per 1M tokens",
        "price_comparison": "favorable",
        "migration_complexity": "medium",
        "model_change": true,
        "migration_path": "direct",
        "quota_risk": "low"
      },
      {
        "source_model_id": "gpt-4o",
        "aws_model_id": "openai.gpt-5.6-terra",
        "capabilities_matched": ["text_generation"],
        "capability_gaps": [],
        "honest_assessment": "strong_migrate",
        "source_provider_price": "via OpenRouter — see § Pricing",
        "bedrock_price": "2.20/13.20 per 1M tokens",
        "price_comparison": "mixed",
        "migration_complexity": "medium",
        "model_change": true,
        "migration_path": "mantle_openai_responses",
        "quota_risk": "medium"
      }
    ],
    "capability_mapping": {
      "text_generation": {"parity": "full", "notes": "All three router upstreams land on Bedrock text-generation targets."}
    },
    "code_migration": {
      "primary_pattern": "framework",
      "framework": "openrouter-sdk",
      "files_to_modify": ["src/ai/router_client.py"],
      "dependency_changes": "Replace the OpenRouter SDK call sites with per-provider Bedrock clients (boto3 Converse for Anthropic, Mantle Responses for OpenAI).",
      "openrouter_path": "direct"
    },
    "infrastructure": [],
    "services_to_migrate": []
  },
  "regional_warnings": [],
  "multi_model_warnings": [
    {"type": "multi_model_tiered", "message": "Three models detected behind one gateway; a 3-tier routing strategy is recorded above."}
  ],
  "agentic_design": null
}
